{
  "$schema": "https://json-schema.org/draft/2020-12/schema",
  "type": "object",
  "additionalProperties": false,
  "required": ["schema_version", "stream", "stream_revision", "subject_kind", "types"],
  "properties": {
    "schema_version": {"const": 1},
    "stream": {"type": "string", "minLength": 1, "maxLength": 80},
    "stream_revision": {"type": "integer", "minimum": 1},
    "subject_kind": {"type": "string"},
    "types": {
      "type": "object", "minProperties": 1, "maxProperties": 64,
      "additionalProperties": {
        "type": "object", "additionalProperties": false, "required": ["required", "fields"],
        "properties": {
          "required": {"type": "array", "items": {"type": "string"}, "maxItems": 64},
          "fields": {
            "type": "object", "maxProperties": 64,
            "additionalProperties": {
              "oneOf": [
                {"type": "string"},
                {"type": "object", "additionalProperties": false, "required": ["enum"],
                 "properties": {"enum": {"type": "array", "items": {"type": "string"}, "maxItems": 64}}}
              ]
            }
          }
        }
      }
    },
    "projection": {},
    "latest_by": {}
  }
}
